brand,url,category,category_long,segment,competitor_1,competitor_2,use_case_1,use_case_2,integration_1,integration_2,role,aliases
Pipedrive,pipedrive.com,CRM,visual sales CRM for SMBs,small and mid-size sales teams,HubSpot,Salesforce,manage a visual sales pipeline,track deals and forecast revenue,Slack,Zapier,VP Sales at a 50-person company,Pipedrive CRM
Close,close.com,CRM,sales CRM for inside sales teams,early-stage startups,Pipedrive,HubSpot,track sales pipeline,manage follow-ups automatically,Slack,Zapier,head of sales at a 20-person startup,"Close CRM,close.io"
Attio,attio.com,CRM,modern CRM for high-growth B2B startups,B2B startups,Salesforce,HubSpot,manage customer relationships,automate revenue workflows,Slack,Zapier,founder or RevOps lead at a Series A startup,attio.com
Apollo.io,apollo.io,CRM,B2B sales intelligence and outreach platform,SDR teams at B2B companies,ZoomInfo,Outreach,build targeted prospect lists,automate cold email sequences,Salesforce,HubSpot,VP Sales or SDR manager,"Apollo,Apollo io"
Salesflare,salesflare.com,CRM,automated CRM for small B2B companies,small B2B teams and agencies,Pipedrive,HubSpot,log sales activities automatically,track email opens and follow-ups,Gmail,LinkedIn,founder or solo sales rep at a startup,Salesflare CRM
Copper,copper.com,CRM,Google-native CRM for agencies and consultants,Google Workspace power users,HubSpot,Pipedrive,manage client relationships inside Gmail,track project and sales stages,Google Workspace,Slack,agency owner or consultant,Copper CRM
Nutshell,nutshell.com,CRM,all-in-one CRM and email marketing for B2B teams,small and mid-size B2B sales teams,HubSpot,Salesforce,manage leads and track pipeline progress,automate email drip campaigns,Gmail,Mailchimp,sales manager at an SMB,Nutshell CRM
LeadIQ,leadiq.com,CRM,prospecting and lead capture platform for SDRs,SDR and outbound sales teams,ZoomInfo,Apollo.io,capture prospect data from LinkedIn,sync contacts and activities to CRM,Salesforce,LinkedIn,SDR manager or sales ops lead,LeadIQ Prospecting
Folk,folk.app,CRM,collaborative CRM for founders and agencies,startup founders and agency leads,HubSpot,Attio,manage investor and partner relationships,track relationship touchpoints across channels,Gmail,Notion,founder or BD lead at an early-stage startup,Folk CRM
Amplemarket,amplemarket.com,CRM,AI-powered sales intelligence and engagement platform,outbound sales teams at B2B companies,Apollo.io,ZoomInfo,find and contact ideal prospects automatically,automate multi-channel outreach sequences,Salesforce,LinkedIn,SDR manager or head of outbound sales,Amplemarket AI
Mixpanel,mixpanel.com,product analytics,event-based product analytics for SaaS companies,product and growth teams at SaaS companies,Amplitude,PostHog,track user engagement and feature adoption,analyze funnel conversion rates,Segment,Slack,VP Product or head of growth,Mixpanel Analytics
Amplitude,amplitude.com,product analytics,digital analytics platform for enterprise and mid-market teams,mid-market to enterprise product teams,Mixpanel,Pendo,analyze product usage and user behavior,optimize onboarding and conversion funnels,Segment,Salesforce,VP Product or Chief Product Officer,Amplitude Analytics
PostHog,posthog.com,product analytics,open-source product analytics platform for developer teams,developer-led product teams,Mixpanel,Amplitude,self-host product analytics without third-party services,track feature flags and run A/B experiments,GitHub,Slack,engineering lead or head of product,PostHog Analytics
Pendo,pendo.io,product analytics,product experience and analytics platform for enterprise SaaS,enterprise SaaS product teams,Amplitude,Mixpanel,guide users through in-app onboarding tours,track feature adoption and measure NPS,Salesforce,Zendesk,VP Product or Product Ops Manager,Pendo.io
June.so,june.so,product analytics,B2B product analytics built on Segment for early-stage teams,early-stage B2B SaaS teams,Mixpanel,PostHog,track user activation and product-qualified leads,identify accounts likely to churn early,Segment,HubSpot,founder or head of product at a B2B SaaS startup,June
Metabase,metabase.com,business intelligence,open-source BI and data visualization tool,data and operations teams at startups and SMBs,Tableau,Looker,build dashboards and reports without writing SQL,share data insights with non-technical stakeholders,PostgreSQL,MySQL,data analyst or head of data,Metabase BI
Plausible,plausible.io,web analytics,privacy-first web analytics for SaaS founders,privacy-conscious SaaS founders and developers,Google Analytics,Mixpanel,track website traffic without cookies or consent banners,monitor conversion funnels without compromising user privacy,WordPress,Gatsby,SaaS founder or marketing manager,Plausible Analytics
Klipfolio,klipfolio.com,business intelligence,cloud dashboard and KPI tracking tool for SMBs,marketing and operations teams at SMBs,Google Data Studio,Tableau,build KPI dashboards connected to multiple data sources,create automated executive reports without manual data entry,Google Analytics,HubSpot,marketing ops lead or COO,Klipfolio Dashboard
Supermetrics,supermetrics.com,marketing analytics,marketing data pipeline tool for agencies and in-house teams,digital marketing agencies and in-house marketing teams,Funnel.io,Fivetran,pull marketing data from all ad platforms into spreadsheets,automate marketing reporting across all channels,Google Analytics,Facebook Ads,marketing analyst or head of marketing,Supermetrics for Google Sheets
FullStory,fullstory.com,product analytics,digital experience analytics with session replay,product and UX teams at mid-market SaaS companies,Hotjar,Mouseflow,replay user sessions to understand UX friction points,identify rage clicks and broken flows in the product,Segment,Amplitude,VP Product or head of UX research,"Full Story,FullStory DX"
Retool,retool.com,internal tooling,low-code platform for building internal tools and dashboards,engineering and operations teams at mid-market companies,AppSmith,Budibase,build internal dashboards and admin panels quickly,create CRUD apps without full-stack engineering effort,PostgreSQL,Stripe,VP Engineering or CTO at a growing startup,Retool App
Linear,linear.app,project management,issue tracking and project management for software teams,software development teams at fast-growing companies,Jira,Asana,track engineering tasks and sprints efficiently,manage product roadmaps and coordinate releases,GitHub,Slack,engineering manager at a fast-growing startup,Linear App
Sentry,sentry.io,error monitoring,application performance monitoring and error tracking platform,engineering teams at SaaS companies,Datadog,Bugsnag,catch and fix production errors before users notice,monitor application performance and response latency,GitHub,Slack,engineering lead or DevOps manager,Sentry.io
Vercel,vercel.com,deployment,frontend cloud and deployment platform for modern web apps,frontend engineering teams at SaaS companies,Netlify,AWS Amplify,deploy and scale Next.js applications globally,manage preview deployments for every pull request,GitHub,Next.js,head of frontend engineering or CTO,Vercel Cloud
Render,render.com,cloud infrastructure,modern cloud hosting platform for web services and databases,startup and scale-up engineering teams,Heroku,Railway,deploy web services and databases without DevOps complexity,run background workers and cron jobs reliably in production,GitHub,PostgreSQL,DevOps lead or backend engineer at a startup,Render Cloud
